{
  "schemaVersion": "1.0",
  "artifactType": "historical-validation",
  "recordedAt": "2026-08-29T06:42:30+08:00",
  "baseRevision": "eb937123f0f86d240359cf456fc5157186206edd",
  "currentRevision": "eb937123f0f86d240359cf456fc5157186206edd",
  "workingTreeDirty": true,
  "workingTreeDiffDigest": {"algorithm":"sha256","value":"08090e9b0731eec5a62117035d3e250aae15fcf59a6adffe33b1823c4abafaa4","entryCount":512,"maxEntries":512,"scope":"git diff HEAD --name-status plus sorted untracked relative-path manifest; first 512 canonical entries only; validation record/schema excluded to avoid self-reference","includesFileContents":false,"includesSecrets":false},
  "currentReplayBasis": "currentReplay commands ran against this dirty working tree rooted at baseRevision; the bounded digest identifies its tracked diff and untracked path/size manifest without embedding file contents or secrets.",
  "sourcePolicy": "雙層驗證：currentReplay 僅記錄目前工作樹可安全重跑的結果；historicalReplay 必須有 task-level 可定位的 git revision、獨立 evidence locator，且可隔離、無外部寫入才可 replay；同一 clean revision 可覆蓋多個獨立測試任務。smoke-tests、closeout 與 working-tree 日期只作 Sourced Fact，不冒充歷史 Passport。Chrome、CodeRabbit、Critic、外部安裝/發布、缺 revision 或不可復原者保持 Unknown。",
  "runs": {
    "R1": { "command": "python -m unittest tests.test_bootstrap_mission_center tests.test_check_mission_center tests.test_doctor_mission_center tests.test_normalize_mission_center tests.test_sync_mission_center tests.test_mission_maintenance -q", "status": "pass", "result": "exit 0; Ran 83 tests; OK (skipped=1)", "limitations": "目前工作樹重跑；不證明歷史 revision 或人工驗收。" },
    "R2": { "command": "python -m unittest tests.test_runtime_protocol tests.test_execution_continuity tests.test_evidence_envelope tests.test_reconcile_mission_center tests.test_project_map tests.test_shift_loss_eval tests.test_research_portfolio tests.test_optimization tests.test_steelman_contract -q", "status": "pass", "result": "exit 0; Ran 125 tests; OK (skipped=4)", "limitations": "目前工作樹重跑；snapshot 測試輸出一則預期的 CLI usage error；不證明人工/外部 gate。" },
    "R3": { "command": "python -m unittest tests.test_critic_contract tests.test_codex_cli_compatibility tests.test_machine_contracts tests.test_prompt_router tests.test_skill_contract tests.test_supply_chain_policy tests.test_release_metadata -q", "status": "pass", "result": "exit 0; Ran 54 tests; OK", "limitations": "僅契約/本機測試；不證明 CodeRabbit、GitHub review 或實際 plugin 安裝。" },
    "R4": { "command": "python -m unittest tests.test_hud_autolaunch tests.test_hud_assets tests.test_visual_state -q", "status": "pass", "result": "exit 0; Ran 68 tests; OK", "limitations": "本機 HTTP/asset contract；未執行 Chrome desktop/mobile journey，因此視覺驗收仍 Unknown。" },
    "R5": { "command": "python -m unittest tests.test_publish_local tests.test_per_project_release -q", "status": "fail", "result": "exit 1; Ran 28 tests; FAILED (1 failure, 1 skipped); test_per_project_release.test_ci_runs_unit_and_single_workspace_cli_checks 不符合現行 workflow matrix 文字契約。", "limitations": "測試使用暫存目錄；未執行正式外部 publish/register；fail 是目前契約回歸，不推論歷史結果。" },
    "R6": { "command": "python -m unittest tests.test_install_wrappers -q", "status": "unknown", "result": "超過 30 秒無輸出，已停止自有測試程序，無 final summary。", "limitations": "P1 capability limitation：installer wrapper worker 可能等待外部/平台程序；未觸碰真實安裝副本，不能推論產品失敗。" },
    "R7": { "command": "python -m unittest discover -s tests -p \"test_*.py\" -q", "status": "unknown", "result": "啟動後先出現 snapshot CLI usage error，超過 bounded wait 無 final summary，已停止自有程序。", "limitations": "完整 suite 未完成；不可用局部成功推定全量通過。" },
    "R8": { "command": "cargo metadata --locked --format-version 1", "status": "unknown", "result": "exit 1; 本次 Windows worker 的 PATH 找不到 cargo executable。", "limitations": "P1 capability limitation：本次 worker 沒有明確 Rust toolchain 執行證據；未修改 Rust workspace，不能推論產品失敗或 supply-chain 不安全。" },
    "R9": { "command": "python skills/mission-center/scripts/doctor_mission_center.py .", "status": "pass", "result": "exit 0; MissionCenter doctor: OK; evidence reconciliation returns migration warning because some tasks still have no envelopes.", "limitations": "doctor 為唯讀檢查；current replacement envelopes are result=unknown and the remaining warning is migration debt, not a fabricated pass。" },
    "R10": { "command": "python skills/mission-center/scripts/doctor_mission_center.py tests/fixtures/demo-workspace", "status": "pass", "result": "exit 0; MissionCenter doctor: OK；含 legacy snapshot、missing ledger、old derived date、migration debt warnings。", "limitations": "fixture doctor only；warnings 不表示 canonical workspace 或歷史任務已完成 migration。" },
    "R11": { "command": "python -m unittest tests.test_supply_chain_policy tests.test_release_metadata tests.test_hud_assets tests.test_hud_autolaunch tests.test_execution_continuity tests.test_reconcile_mission_center -q", "status": "pass", "result": "detached clean worktree 80ddbb3；exit 0；78 tests OK。", "limitations": "只記錄可重播的 repository tests；Chrome、CodeRabbit、GitHub artifact 與外部發布不在此結果內。" },
    "R12": { "command": "python -m unittest tests.test_runtime_protocol tests.test_machine_contracts tests.test_project_map tests.test_shift_loss_eval tests.test_research_portfolio tests.test_optimization tests.test_steelman_contract tests.test_critic_contract tests.test_codex_cli_compatibility tests.test_evidence_envelope -q", "status": "pass", "result": "detached clean worktree 80ddbb3；exit 0；125 tests OK（4 skipped）。", "limitations": "只擴大自動測試覆蓋；不把人工 review、fuzz 或外部 endpoint 的歷史狀態標成 pass。" }
    ,"R13": { "command": "python -m unittest tests.test_skill_contract tests.test_mission_maintenance tests.test_doctor_mission_center tests.test_bootstrap_mission_center tests.test_normalize_mission_center tests.test_sync_mission_center -q", "status": "pass", "result": "detached clean worktree 80ddbb3；exit 0；99 tests OK（1 skipped）", "limitations": "僅涵蓋可重播的 bootstrap、normalize、sync、doctor、skill 與 maintenance 自動測試；不證明外部審查、瀏覽器或發布。" }
  },
  "tasks": [
    {"taskId":"MC-001","verification":"bootstrap exact-layout tests","currentReplay":{"status":"pass","classification":"Observed Fact","run":"R1","locator":"tests/test_bootstrap_mission_center.py","limitations":"R1 通過；無 task-level 歷史 revision。"},"historicalReplay":{"status":"pass","classification":"Observed Fact","sourceClassification":"Observed Fact","revision":"80ddbb35125d46db410d317cc65d56f5889fdf01","locator":"80ddbb35125d46db410d317cc65d56f5889fdf01:tests/test_bootstrap_mission_center.py","limitations":"clean detached worktree；R13 bootstrap exact-layout tests 通過；不涵蓋外部安裝。"}},
    {"taskId":"MC-002","verification":"unittest focused modules","currentReplay":{"status":"pass","classification":"Observed Fact","run":"R1","locator":"tests/test_bootstrap_mission_center.py; tests/test_normalize_mission_center.py; tests/test_sync_mission_center.py","limitations":"R1 通過；無 task-level 歷史 revision。"},"historicalReplay":{"status":"pass","classification":"Observed Fact","sourceClassification":"Observed Fact","revision":"80ddbb35125d46db410d317cc65d56f5889fdf01","locator":"80ddbb35125d46db410d317cc65d56f5889fdf01:tests/test_bootstrap_mission_center.py;tests/test_normalize_mission_center.py;tests/test_sync_mission_center.py","limitations":"clean detached worktree；R13 focused modules 皆通過；不涵蓋外部服務。"}},
    {"taskId":"MC-003","verification":"unittest visual-state module","currentReplay":{"status":"pass","classification":"Observed Fact","run":"R4","locator":"tests/test_visual_state.py","limitations":"R4 通過；未做歷史環境重播。"},"historicalReplay":{"status":"unknown","classification":"Unknown","sourceClassification":"Sourced Fact","revision":null,"locator":"MissionCenter/smoke-tests.md#MC-003","limitations":"歷史 smoke row 沒有唯一 commit。"}},
    {"taskId":"MC-004","verification":"unittest publish module","currentReplay":{"status":"pass","classification":"Observed Fact","run":"R5","locator":"tests/test_publish_local.py","limitations":"publish module 測試通過；同組 per-project CI 契約另有 fail，未把該 fail 歸因到本 task。"},"historicalReplay":{"status":"unknown","classification":"Unknown","sourceClassification":"Sourced Fact","revision":null,"locator":"MissionCenter/smoke-tests.md#MC-004","limitations":"無唯一 revision，未重播舊 publisher。"}},
    {"taskId":"MC-005","verification":"doctor returns zero","currentReplay":{"status":"pass","classification":"Observed Fact","run":"R1","locator":"tests/test_doctor_mission_center.py","limitations":"fixture unit tests 通過；根 workspace R9 另有 evidence reconciliation fail。"},"historicalReplay":{"status":"pass","classification":"Observed Fact","sourceClassification":"Observed Fact","revision":"80ddbb35125d46db410d317cc65d56f5889fdf01","locator":"80ddbb35125d46db410d317cc65d56f5889fdf01:tests/test_doctor_mission_center.py","limitations":"clean detached worktree；R13 doctor tests exit 0；僅 fixture/contract，無外部 gate。"}},
    {"taskId":"MC-006","verification":"release metadata tests","currentReplay":{"status":"pass","classification":"Observed Fact","run":"R3","locator":"tests/test_release_metadata.py","limitations":"release metadata tests 通過；CI matrix 整體文字契約在 R5 有 fail。"},"historicalReplay":{"status":"unknown","classification":"Unknown","sourceClassification":"Sourced Fact","revision":null,"locator":"MissionCenter/smoke-tests.md#MC-006","limitations":"branch protection/API 歷史狀態無唯一 revision，未外查。"}},
    {"taskId":"MC-007","verification":"release metadata tests","currentReplay":{"status":"pass","classification":"Observed Fact","run":"R3","locator":"tests/test_release_metadata.py","limitations":"R3 通過；不代表外部 release。"},"historicalReplay":{"status":"unknown","classification":"Unknown","sourceClassification":"Sourced Fact","revision":null,"locator":"MissionCenter/smoke-tests.md#MC-007","limitations":"無唯一歷史 revision。"}},